title,link,preview
"신학철 LG화학 ""올해는 '실행의 해'…변화·혁신 주도하자""",http://www.zdnet.co.kr/view/?no=20200102114431,"신학철 LG화학 최고경영자(CEO) 부회장이 2일 ""임직원이 '변화와 혁신의 주도자'가 돼야 한다""고 강조했다. 신 부회장은 이날 신년사를 통해 ""앞으로의 변화의 속도와 양은 지금까지보다 훨씬 빠르고 클 것으로 예상된다""며 ""올해는 LG화학의 '실행의 해(The Year of execution)'가 될 것""이라고 밝혔다. 아울러 ▲시장·고객 중심의 포트폴리오 강화 ▲성과 중심의 연구·개발(R&D)혁신 ▲밸류체인 전 영역에 걸친 효율성 제고 ▲글로벌 기업에 걸맞은 인재·리더십·조직문화 등 실행을 위한 '4대 변화 이니셔티브(Initiatives)'를 제시했다. 신 부회장은 ""과거의 성장 방식과 경쟁 전략에서 과감하게 벗어나야 한다""며 ""철저하게 시장과 고객이 중심이 돼 우리의 사업방식을 혁신하고, '커머셜 엑설런스(Commercial Excellence)' 역량을 강화해야 한다""고 말했다. 이어 ""빠르게 성장하는 배터리·자동차 소재 분야를 중심으로 고객과 시장을 감동시킬 수 있는 미래 과제 개발에 더욱 집중하고, 육성사업들의 경쟁력 강화를 위한 기반기술을 굳건히 다져야 한다""며 "", 인공지능(AI)을 적극 활용하고 열린 혁신(Open Innovation)을 활성화해 R&D 잠재력과 효율성을 높이자""고 당부했다. 신 부회장은 ""우리가 가진 전 자산의 효율성을 극대화하기 위해서는 '디지털 전환(DX)'과 '린 식스 시그마(Lean Six Sigma·혁신활동 툴)'를 적극 활용해야 한다""며 ""전 영역에 DX를 접목한 혁신과제들을 발굴하고 실행, 전사 효율성 극대화에 DX를 적극 활용하고, 린 식스 시그마를 확고히 뿌리내려 전 부문의 시행 착오와 손실을 줄이고 효율성을 극대화하자""고 말했다. 또 ""영감을 주는 리더십, 끊임없이 공부하고 변화에 앞장서는 리더십이 확산될 수 있도록 다방면의 노력을 기울이겠다""면서 ""익숙한 관성에서 벗어나 새로운 길을 향해 과감히 도전하고, 토론과 학습이 활성화되는 '수평적이고 역동적인 조직문화'를 함께 만들어 나가자""고 제안했다. 마지막으로 신 부회장은 ""지속가능성은 더 이상 선택지가 아닌 기업의 생존 조건""이라며 ""원료·생산·소비·폐기로 이어지는 밸류체인에서 지속가능성을 LG화학만의 차별화 된 가치로 만들어 나가야 한다""고 덧붙였다."
"권봉석 LG전자 사장 ""고객가치 기반 성장·변화 이루자""",http://www.zdnet.co.kr/view/?no=20200102085330,"LG전자 새 사령탑에 선임된 권봉석 최고경영자(CEO) 사장이 디지털 전환을 가속화해 '성장을 통한 변화, 변화를 통한 성장'을 이뤄가겠다고 강조했다. 권봉석 사장은 2일 시무식을 대신해 임직원들에게 이메일로 신년 메시지를 전했다. 권 사장이 보낸 이메일의 제목은 'CEO 일기로 전하는 신년 메시지(New year message from CEO's diary)'였다. 마치 한편의 일기처럼 CEO로서 자성(自省)과 다짐을 담담하게 전했다. 권 사장은 “기존 사업을 중심으로 성장하고 이를 통해 변화의 기반을 준비하는 것은 현재진행형”이라며 “지속적인 성장을 위해서는 변화를 통한 성장에도 노력해야 한다”고 말했다. 권 사장은 “제품에 콘텐츠와 서비스를 연계하거나 커넥티드 디바이스를 기반으로 새로운 성장동력을 확보하는 것이 LG전자가 추구하는 디지털 전환의 핵심”으로 정의했다. 권 사장은 일하는 방식에 대한 고민과 변화도 당부했다. 그는 “고객가치를 기반으로 성장하고 새로운 고객가치를 창출하기 위해 변화해야 한다”며 “모든 역량과 일하는 방식을 고객가치 창출에 초점을 맞출 것”이라고 말했다. 그는 “고객에게 진정으로 사랑받는 LG전자를 만드는 것이 본질적 경쟁력이자 지향점”이라고 강조하며 신년 메시지를 마무리했다. 한편, 권봉석 사장은 조성진 부회장의 후임으로 LG전자 새 사령탑에 선임됐다. 권 사장은 LG전자에는 중대한 분기점이 될 디지털전환(Digital Transformation)을 통해 차별화된 고객 가치를 창출하는 임무를 맡았다. , 인공지능(AI), 연결, 콘텐츠를 비롯한 디지털 전환 핵심 요소에 대한 역량을 갖췄다는 평이다."
하현회 부회장 “2020년 디지털 혁신 직접 챙기겠다”,http://www.zdnet.co.kr/view/?no=20200102095604,"하현회 LG유플러스 부회장이 2020년 디지털 혁신을 적극 추진하겠다는 의지를 드러냈다. 하현회 부회장은 2일 온라인 시무식을 통해 “현재의 사업방식과 일하는 방식으로는 차별화된 서비스를 제공할 수 없고 이용자의 니즈와 불편을 파악하기도 힘들다”며 “근본적인 변화와 혁신을 이루기 위해서는 전 사업영역에서 디지털 혁신을 적극 추진해야 한다”고 임직원을 독려했다. 이날 시무식은 디지털 혁신 의지를 반영해 지금까지의 오프라인 형태 시무식과 달리 온라인으로 진행됐다. LG유플러스는 하현회 부회장의 신년사를 영상으로 사전 제작하고, 이를 모바일 앱을 통해 시청할 수 있도록 했다. 하 부회장은 지난해를 돌이켜보며 5G에서 차별화된 경쟁력을 확보한 점과 CJ헬로를 성공적으로 인수해 미래사업기반을 확보한 점에 대한 임직원의 노고를 치하했다. 이어 미래 성장을 위해 각종 신기술을 기반으로 시스템을 혁신하는 '디지털 전환'이 필요하다고 강조했다. 하 부회장은 “디지털 전환은 새롭게 도입하는 과제가 아니라 모든 이용자 접점에서 이용자가 지금보다 쉽고 편안하며 즐겁게 경험할 수 있도록 프로세스와 시스템을 혁신하여 실질적 성과를 창출하는 것”이라며 “AI, , 클라우드, UI·UX 역량을 높이고 이를 적용함으로써 성과를 내야 한다”고 말했다. 디지털 전환 추진을 비롯해 올해 추진해야 할 중점 과제로는 ▲전 사업영역 경험 혁신 ▲견실한 수익구조 확보 ▲철저한 미래사업 준비 ▲완벽한 품질·안전·보안 관리 ▲역동적 조직문화 조성 등 5가지를 제시했다. 특히 하 부회장은 디지털 전환 추진과 관련해 진행성과를 CEO와 각 부문장이 참여하는 'DX 추진위원회'를 통해 공유하는 뜻을 전했다. 디지털 전환 진척도를 직접 나서서 챙기겠다는 의지를 밝힌 셈이다. 하 부회장은 “디지털 전환을 통해 이용자 경험을 혁신시킨다면 단기적으로는 사업 목표를 달성할 뿐만 아니라 장기적으로는 새로운 사업 기회를 확보하여 미래성장 기반이 될 것”이라고 강조했다. 한편, 하 부회장은 올해 미디어 부문 사업과 관련해서는 IPTV와 케이블TV라는 양대 플랫폼을 활용해 시너지를 꾀하겠다는 구상을 밝혔다. 하 부회장은 “LG헬로비전은 독립기업으로서 자율성과 투명성을 가지고 업계 1위의 지위를 유지해 나갈 것”이라며 “양대 플랫폼을 기반으로 다양한 융복합 서비스를 쉽고 편안하게 이용할 수 있도록 만반의 준비를 해나가자”고 설명했다."
마이너리티 리포트가 현실로…'AI+CCTV'로 범죄 예측 가능해진다,http://www.zdnet.co.kr/view/?no=20200102091441,"국내 연구진이 과거 범죄 통계정보와 CCTV 영상을 자동 분석해 범죄 등 위험 상황 발생을 예측하는 인공지능(AI) 기술을 개발하고 있어, 향후 범죄 피해를 예방하는데 큰 도움이 될 전망이다. 한국전자통신연구원(ETRI)은 현재 CCTV 상황을 분석해 어떤 유형의 범죄가 발생할지 확률적으로 보여주는 '예측적 영상보안 원천기술'을 지난해부터 개발 중이라고 밝혔다. 따라서 향후에는 특정지역의 장소에서 특정시간대 폭행 등 4대 강력범죄 대상 범죄정보의 예측이 가능해질 전망이다. 예컨대 우범지대로 특정된 지역에서 새벽시간대 남녀가 일정 거리를 두고 걸어간다면 매우 높은 비율의 우범률이 %단위로 표시되는 방식이다. 이 기술은 현재의 상황을 먼저 분석하고 과거의 범죄 데이터를 비교해 향후 일어날 수도 있는 범죄가 얼마나 위험한지를 판단, 먼저 대응한다는 의미다. ETRI는 더욱 고도화된 예측 치안 기술을 개발하기 위해 선진국이 진행 중인 통계적 범죄 예측 방식에 지능형 CCTV 영상분석 기술을 더했다. 기존 선진국의 범죄 예측시스템은 단순히 과거 범죄통계정보만을 분석해 미래의 위험도를 측정했다면 이 기술은 CCTV를 통해 실시간 확인되는 현재 상황 정보까지 반영, 복합적으로 몇 분/시간 후 범죄 발생 위험도를 알아낸다. 가까운 미래에 발생할 수 있는 위험에 가장 중요한 요소가 현재 발생하고 있는 상황이란 점에서 착안했다. 범죄가 발생한 CCTV 영상을 되돌아보면 그 당시 위험상황은 아니었더라도 평상시와 다른 반복된 행동이 뒤늦게 감지하는 경우가 많다. 연구진은 이 같은 사실에서 현재 CCTV 상황을 과거 범죄패턴에 비춰 얼마나 위험한지 분석한다. 즉, 과거 발생한 범죄의 '데자뷰(Deja vu)'를 재인식하는 셈이다. 위험 예측분석은 AI 분석 과정을 통해 이뤄진다. 일반적으로 범죄가 발생하는 지역은 육안으로 식별이 어려운 열악한 환경이 대부분이기에 고성능 AI기술이 필수적으로 요구된다. 우선 연구진은 보유하고 있는 '지능형 CCTV 영상분석기술'로 현재 상황을 정확히 판단할 예정이다. 구두 발자국의 '똑딱'소리 요소를 영상으로 전환하는 시뮬레이션을 통해 행동을 파악한다. 이로써 긴박한 뜀박질인지 지속적 미행과 같은 상황인지 요소에 집중할 예정이다. 또한, 시각지능 기술로 화면 속 사람이 모자나 마스크, 안경을 쓰고 있는지, 배낭 등 도구를 지참했는지 등의 속성도 추가적으로 파악할 예정이다. 다음으로 인식된 현재 상황이 과거 범죄 통계 정보와 비교해 위험도를 측정한다. 예를 들면, 새벽 2시 후미진 골목에서 마스크와 모자를 쓴 남성이 젊은 여성을 따라가는 화면에 잡힌다면 위험도를 높게 책정해 알람을 주는 방식이다. 비슷한 패턴이 오후 2시, 서울 명동 거리라면 위험도는 크게 낮아진다. 연구진이 개발할 AI 기술에는 법원 판결문 2만 건을 분석해 범죄 발생 시 함께 나타나는 요소를 파악하고 미국 플로리다주립대의 범죄 영상 데이터와 범죄 상황을 가정한 영상도 추가 확보해 학습할 예정이다. 또한, 연구진은 성범죄 전과가 있는 대상자를 관리하는 기술도 개발할 예정이다. 현재 위치정보 기준으로 발생하는 알람의 고의성을 판단하기 어렵고 사람이 다수 섞인 경우 CCTV를 살펴봐도 대상자 판별이 어렵다는 단점이 있었다. ETRI는 연구진이 보유하고 있는 사람 재식별기술(Person Re-ID)을 활용, 전자발찌 착용자처럼 고위험군 특정인의 경로를 분석하면 즉각 인근 CCTV로 사람을 찾게 만들어줄 계획이다. 이로써 정확히 우범자의 관리 대상 파악이 가능해지고 위험 행동 징후를 파악해 빠르게 대응을 할 수 있도록 만들 예정이다. 연구진은 최종적으로 ▲동적위험 예측분석기술 ▲휴먼심층분석기술 ▲능동적AI생활위험도 분석기술 ▲예측적 사회안전 리빙랩 등 기술개발을 할 계획이다. 이번 연구에는 ETRI를 중심으로 법무부 위치추적중앙관제센터, 경찰청, 제주도, 서울 서초구 등 산?학?연?관이 공동으로 참여해 실증 및 현장 검증을 거쳐 치안 요구사항을 반영해 기술을 고도화한다는 방침이다. 아울러, 전국 229개 지방자치단체 CCTV통합관제센터와 경찰관제시스템 등에 본 기술이 적용되면 CCTV 영상만으로 범죄발생위험도를 실시간으로 확인이 가능할 것으로 보고 있다. 가로등 조명 제어, 경고음, 현장 출동 등 대응체계도 구축하고 영상 프라이버시 마스킹 등 개인 민감 정보 보호기술을 통해 시민의 사생활 침해 우려도 근본적으로 해소한다는 계획이다. 이 과제는 과학기술정보통신부와 정보통신기획평가원의 정보보호핵심원천기술개발 사업 사회문제해결형 과제인 '선제적 위험대응을 위한 예측적 영상보안 핵심기술 개발'의 일환으로 오는 2022년까지 수행된다. 김건우 ETRI 정보보호연구본부 김신인증?물리보안연구실장은 “CCTV가 단순히 범죄 발생을 감지하는 수준을 넘어 스스로 위험발생 가능성을 최대 80%까지 예측하고 예방할 수 있는 신경망 모델을 개발해 미래형 첨단 사회안전시스템으로 발전할 수 있도록 노력하겠다”고 말했다."
"中 화웨이, 첫 무인 매장...로봇이 24시간 판매",http://www.zdnet.co.kr/view/?no=20200102082548,"직원없이 로봇 만으로 운영되는 화웨이의 유통 실험이 시작됐다. 현장에서 구매할 수도 있지만 인터넷에서 구매하고 픽업만 할 수도 있어 온오프라인이 결합한 '신유통' 시도로도 분석된다. 중국 언론 콰이커지에 따르면 화웨이가 1일 무인(無人) 판매점 운영을 개시했다. 중국 우한에 소재한 이 판매점은 넓지 않은 크기이지만 화웨이의 첫 무인 판매점이다. 24시간 연중무휴로 운영되는 이 매장에서는 스마트 기계팔이 쇼핑을 돕는다. 이 무인 판매점은 우한 광구(光谷)신발전국제센터 내에 위치해있으며 원통형 건축물이 360도를 감싸는 투명한 유리로 설계돼 밖에서도 안쪽이 훤하게 들여다보인다. 이 매장에서 쇼핑을 할 때 소비자는 두 개의 커다란 기계팔의 도움을 받게 된다. 더 크기가 큰 기계팔이 진열대 상자에서 카운터쪽으로 제품을 옮겨오면, 작은 기계팔이 제품을 집어 소비자가 가져갈 수 있는 위치(출화구)에 놓는다. 소비자가 유리를 통해 기계팔의 움직임을 모두 볼 수 있다. 소비자는 인터넷에서 예약구매를 하거나 현장에서 구매하는 방식 중 선택할 수 있다. 이 곳에서 화웨이의 스마트폰, 노트북PC, 태블릿PC, 스마트워치 등 시리즈 제품을 사면된다. 화웨이 관계자에 따르면 컨수머비즈니스그룹은 스마트한 체험 강화를 핵심 전략으로 삼으면서 클라우드컴퓨팅, , 사물인터넷(IoT), 인공지능(AI) 등 기술을 통한 경영모델의 혁신을 꾀하고 있다. 유통업의 스마트화에 맞춰 새로운 기술 수단으로 유통업의 디지털화를 도모하겠단 의지다."
인간 지식 넘보는 AI...'사람 중심' 윤리 기준 필수,http://www.zdnet.co.kr/view/?no=20191231230024,"""성공적으로 안전한 인공지능(AI)을 만들 확률은 단 5~10%뿐이다...사람의 지능을 훨씬 뛰어 넘는 울트라 인텔리전트 AI가 등장했을 때 기대할 수 있는 가장 자비로운 상황은 그들이 우리를 애완동물처럼 대하는 것뿐이다."" (일론 머스크 테슬라 대표) ""AI는 전세계적으로 적용되는 큰 영향력을 가진 기술이다. 이 기술은 매우 빠르게 성장하고, 또 강력하게 영향을 미치고 있다. 인류가 합심해서 AI가 인간의 경험을 개선하는 올바른 목적에 쓰이도록 노력해야 한다."" (MS 스티븐 A, 크라운 인권 법률 자문 담당 부사장) 세계 각국이 AI 기술 연구개발(R&D)에 뛰어든 가운데, 미래의 AI가 인간의 존엄성을 해치지 않고 공생할 수 있는 윤리와 법제도 마련이 필요하다는 목소리가 높아지고 있다. 또 기계가 사람의 일자리를 대체할 가능성이 높아지게 되는 만큼, 안정적인 고용 정책의 필요성도 커지고 있다. 이에 우리 정부는 AI를 국가 전략 핵심 중 하나로 세움과 동시에, AI 확산과 함께 따라 커지는 불안을 선제적으로 없애기 위한 정책을 추진하기로 했다. 신기술 분야 중심으로 직업훈련을 전면 개편해 고용 가능성을 높이고, 역기능과 보안 위협에 대비한 AI 윤리규범을 확립한다는 방침이다. ■ AI 진흥과 역기능 대책 세우는 정부... AI와 '인간 중심' 조화 공존 필수 정부는 지난 달 17일 'AI 국가전략'을 통해 AI를 가장 잘 활용하는 국가 건설을 위해 ▲AI 경쟁력 혁신 ▲AI 활용 전면화 ▲AI와 조화 공존을 핵심 키워드로 내세웠다. 이 중 AI 기술 발전이 가져올 일자리 변화, 그리고 기계(AI)가 인간의 지능과 능력을 뛰어넘으면서 발생될 수 있는 윤리적인 문제들을 해결하려는 정부의 정책에도 적지 않은 관심이 쏠릴 전망이다. 왜냐하면 AI는 과거 자동차가 마차를 대체하고, 기계가 인간의 노동력을 대체했던 수준을 넘어 인간 자체를 대체하는 수준까지 발전할 것으로 전망되고 있어서다. 특히 인간이 AI의 알고리즘을 설계하는 것이 아니라, 멀지 않은 미래에 AI가 스스로 자신을 재설계함으로써 초AI가 되는 특이점이 온다는 전문가들의 예측이 설득력을 얻고 있는 상황이다. 아울러 보안 위협과 실제와 구분이 어려운 딥페이크(딥러닝+페이크) 영상 또는 사진이 사회적 혼란을 야기할 위험이 커지면서 이에 대한 안전대책 마련에도 필요성이 커지고 있다. 질병 예측과 치료에 도움을 주고 고된 단순 노동에서 해방시켜줄 수 있는 도구로서 AI 기술 발전에 속도를 높이되, AI가 인간의 존재와 존엄성을 해치지 않는 쪽으로 기술 발전을 이뤄야 한다는 게 전문가들의 중론이다. AI를 개발하는 기업과 개발자, 이를 활용하는 사용자 모두의 윤리 의식이 특히 더 중요한 이유다. 이를 위해서는 AI 개발 초기 단계 때부터 관련된 윤리 규범 정립과 정부의 적절한 정책과 규제가 필요한 것이 사실이다. 이에 우리 정부는 AI 등 지능형 기술을 기반으로 사이버 위협 대응시스템을 고도화하고, 역기능 대응을 위한 기술개발 및 범부처 협업체계를 구성하기로 했다. 사람 중심의 AI, 인간다운 AI 구현을 위해 사회적 공론화와 공감대 형성을 바탕으로 글로벌 수준의 AI 윤리규범을 정립한다는 방침이다. 먼저 새해부터 AI 기반 사이버 침해사고 탐지, 대응에 나선다. 지능형 기술 기반 사이버 침해사고 탐지, 분석, 대응체계를 구축하고 다양한 기기, 네트워크의 취약점 자동분석, 암호 안전성 검증 등 AI 기반 정보보호 기술개발에도 착수한다. 아울러 민간의 정보보호 AI 머신의 종합적 검증 및 컨설팅 제공을 위한 '정보보호 AI 학습지원 센터'도 구축할 계획이다. 또 정부는 AI 발전에 따른 새로운 서비스 분야의 개발과 역기능 방지를 병행하기 위한 R&D 추진 및 범부처 협업체계를 마련하기로 했다. 이를 통해 딥페이크 등 영상합성을 통한 명예훼손, 신원도용, 금융 사기 등의 부작용을 최소화 한다는 방침이다. 이 밖에 AI 제품, 서비스 확산에 대응해 신뢰성과 안전성 등을 검증하는 품질관리체계도 연내에 구축, 추진하기로 했다. 정부는 AI 윤리기준과 실천방안도 마련한다. 지난해 5월 마련된 OECD AI 권고안의 후속조치를 마련하는 등 AI 윤리 관련 국제적 논의를 선도한다는 구상이다. 이를 위해 국제기구, 주요국 등의 AI 윤리 규범 및 논의 동향을 파악, 분석해 글로벌 규범과 정합하는 AI 윤리기준 확립과 실천방안을 올해 마련한다는 계획이다. 사회 구성원들 간의 자율적인 규율 또는 입법화 등 다양한 방식을 고려 중이다. 향후에는 이용자 보호를 위한 중장기적 정책 수립 지원체계를 마련하는 한편, 대상별 AI 윤리교육 커리큘럼을 개발하고 보급할 예정이다. ■ 포용적 일자리 안전망 구축...직업훈련과 교육에 선도적 투자 정부는 또 AI가 사람의 일자리를 대체하게 되면서 포용적 일자리 안전망을 구축하기로 했다. 노동시장 급변으로 인한 사회적 충격 완화와 일자리 변화에 취약한 계층 지원을 위해 생계유지, 취업지원 등 일자리 안전망을 강화한다는 전략이다. 또한 산업 현장인력의 AI 활용 역량 제고와 일자리 이동성 확대를 위해 직업훈련 체계를 AI 중심으로 개편한다는 방침이다. 특히, 예술인 등 다양한 유형의 노동자 보호를 위한 사회보험 적용을 확대하고 중장기적으로 보험 대상을 '근로자'에서 '피보험자'로 변경한다. 실업급여의 지습 수준, 지급기간을 확대하는 등 보장성 강화에도 힘을 쏟는다. 아울러 고용안전망 사각지대 해소를 위한 '국민취업지원제도'를 연내에 도입한다. 이는 저소득 구직자, 폐업 영세자영업자 등 취업 취약계층에게 취업지원서비스를 제공하고, 구직활동을 전제로 소득지원을 강화하는 내용이다. 나아가 AI, 직무 기반 국가 일자리정보플랫폼 고도화 및 일자리 매칭시스템을 구축한다. AI가 일자리 상황을 실시간으로 분석하고, 직무 빅데이터를 기반으로 기업의 수요와 구직자 역량을 매칭해 맞춤형 고용서비스를 제공한다는 구상이다. 정부는 또 신기술 분야 직업훈련을 통해 구직자의 고용가능성을 높이고, 재직자의 신기술 적응력을 향상해 국민의 평생고용 보장을 추진한다. 구직, 전직 지원을 위한 신기술(AI, 핀테크 등) 직업훈련 비중은 2019년 4% 수준에서 2022년 15%까지 끌어올린다는 계획이다. 직업훈련 교사, 강사의 첨단 신산업 분야 역량 강화도 지원한다. 여기에 모든 국민에게 '국민내일배움카드'를 제공해 실업자, 중소기업재직자 위주의 직업훈련 대상을 일반 국민으로 전면 확대한다. 직업훈련 접근성 향상을 위해 현재 서울에 1곳만 있는 이노베이션스퀘어를 올해 지역 거점별로 4개소까지 확대한다는 계획도 세웠다. 과기정통부는 “AI 기반 지능형 기술을 기반으로 사이버 위협 대응시스템을 고도화하고, 역기능 대응을 위한 기술개발 및 범부처 협업체계 구성할 계획”이라며 “AI 확산으로 생길 수 있는 역기능과 보안 위협에 대비해 AI 윤리 규범을 확립하고 가장 안전한 AI 이용환경을 조성할 것”이라고 강조했다."
